{
    "kdf_version": "0.1",
    "dataset": {
        "id": "e001",
        "created_at": "2026-01-15T00:00:00Z"
    },
    "sources": [
        {
            "id": "src1",
            "sha256": "4444444444444444444444444444444444444444444444444444444444444444"
        }
    ],
    "documents": [
        {
            "id": "doc1",
            "type": "document",
            "text": "All contractors must wear helmets in Zone A.",
            "children": [
                {
                    "id": "p1",
                    "type": "paragraph",
                    "text": "All contractors must wear helmets in Zone A.",
                    "children": []
                }
            ]
        }
    ],
    "atoms": [
        {
            "id": "a1",
            "type": "rule",
            "payload": "All contractors must wear helmets in Zone A.",
            "evidence": [
                {
                    "source_id": "src1",
                    "node_path": "document:doc1/paragraph:p1",
                    "locators": {
                        "primary": {
                            "type": "text_offset",
                            "start": 0,
                            "end": 42
                        },
                        "anchors": [
                            {
                                "type": "node_path",
                                "path": "document:doc1/paragraph:p1"
                            },
                            {
                                "type": "span_fingerprint",
                                "algo": "sha256",
                                "value": "aaaaaaaaaaaaaaaaaaaaaaaaaaaaaaaaaaaaaaaaaaaaaaaaaaaaaaaaaaaaaaaa"
                            }
                        ]
                    },
                    "validation": {
                        "status": "needs_review",
                        "method": "sha256(span)"
                    }
                }
            ]
        }
    ]
}