{
    "kdf_version": "0.1",
    "dataset": {
        "id": "v005",
        "created_at": "2026-01-15T00:00:00Z"
    },
    "sources": [
        {
            "id": "src1",
            "uri": "text:mixed_newlines",
            "sha256": "391ba54caa9e9da3dd31dca1eff275e706979e76c1f60c91401f0624734f52b0"
        }
    ],
    "documents": [
        {
            "id": "doc1",
            "type": "document",
            "text": "Line 1\nLine 2\nLine 3",
            "children": []
        }
    ],
    "atoms": [
        {
            "id": "a1",
            "type": "fact",
            "payload": "Line 1",
            "evidence": [
                {
                    "source_id": "src1",
                    "node_path": "document:doc1",
                    "locators": {
                        "primary": {
                            "type": "text_offset",
                            "start": 0,
                            "end": 6
                        },
                        "anchors": [
                            {
                                "type": "node_path",
                                "path": "document:doc1"
                            },
                            {
                                "type": "span_fingerprint",
                                "algo": "sha256",
                                "value": "f65eb5539b742c495786c95d8c4f330bcd466a441b05d59b9e8693a970c311af"
                            }
                        ]
                    },
                    "validation": {
                        "status": "valid"
                    }
                }
            ]
        }
    ]
}