{
    "kdf_version": "0.1",
    "dataset": {
        "id": "v003",
        "created_at": "2026-01-15T00:00:00Z"
    },
    "sources": [
        {
            "id": "src1",
            "uri": "urn:example:manual",
            "sha256": "cccccccccccccccccccccccccccccccccccccccccccccccccccccccccccccccc"
        }
    ],
    "documents": [
        {
            "id": "doc1",
            "type": "document",
            "title": "Safety Manual",
            "text": "Safety Manual",
            "children": [
                {
                    "id": "s1",
                    "type": "section",
                    "title": "PPE",
                    "text": "PPE rules",
                    "children": [
                        {
                            "id": "p1",
                            "type": "paragraph",
                            "text": "Wear goggles in Zone B.",
                            "children": []
                        }
                    ]
                }
            ]
        }
    ],
    "atoms": [
        {
            "id": "a1",
            "type": "rule",
            "payload": "Wear goggles in Zone B.",
            "evidence": [
                {
                    "source_id": "src1",
                    "node_path": "document:doc1/section:s1/paragraph:p1",
                    "locators": {
                        "primary": {
                            "type": "text_offset",
                            "start": 0,
                            "end": 23
                        },
                        "anchors": [
                            {
                                "type": "node_path",
                                "path": "document:doc1/section:s1/paragraph:p1"
                            },
                            {
                                "type": "span_fingerprint",
                                "algo": "sha256",
                                "value": "0a497b887403b019ca593dfa692f45ca5c66956ed75c9587116125575147e344"
                            }
                        ]
                    },
                    "validation": {
                        "status": "valid",
                        "checked_at": "2026-01-15T00:00:00Z",
                        "method": "sha256(span)"
                    }
                }
            ]
        }
    ]
}