{
    "kdf_version": "0.1",
    "dataset": {
        "id": "v001",
        "created_at": "2026-01-15T00:00:00Z"
    },
    "sources": [
        {
            "id": "src1",
            "uri": "urn:example:policy",
            "sha256": "aaaaaaaaaaaaaaaaaaaaaaaaaaaaaaaaaaaaaaaaaaaaaaaaaaaaaaaaaaaaaaaa"
        }
    ],
    "documents": [
        {
            "id": "doc1",
            "type": "document",
            "title": "Example Policy",
            "text": "Root document text.",
            "children": []
        }
    ]
}